image_id,x,y,width,height,english_caption,hindi_original,hindi_corrected,hindi_was_corrected,hindi_reason,hindi_confidence,hindi_explanation,bengali_original,bengali_corrected,bengali_was_corrected,bengali_reason,bengali_confidence,bengali_explanation,malayalam_original,malayalam_corrected,malayalam_was_corrected,malayalam_reason,malayalam_confidence,malayalam_explanation,odia_original,odia_corrected,odia_was_corrected,odia_reason,odia_confidence,odia_explanation
11,45,30,545,436,it is an indoor scene,यह एक इनडोर दृश्य है,यह एक इनडोर दृश्य है,False,none,1.0,The translation is correct and conveys the same meaning as the original English caption without any issues.,এটি একটি অভ্যন্তরীণ দৃশ্য,এটি একটি অভ্যন্তরীণ দৃশ্য,False,none,1.0,The translation is correct and maintains the meaning of the original English caption without any issues.,ഇത് ഒരു ഇൻഡോർ രംഗമാണ്,ഇത് ഒരു ഇൻഡോർ രംഗമാണ്,False,none,1.0,The translation from English to Malayalam is accurate and maintains the meaning of the original caption without any issues.,ଏହା ଏକ ଭିତର ଦୃଶ୍ୟ |,ଏହା ଏକ ଭିତର ଦୃଶ୍ୟ |,False,none,1.0,The translation is accurate and maintains the meaning of the original English caption without any issues.
17,306,239,189,94,Computer screens turned on,कंप्यूटर स्क्रीन चालू,कंप्यूटर स्क्रीन चालू,False,none,1.0,"The Hindi translation is a direct and accurate representation of the English caption, maintaining the intended meaning without any errors.",কম্পিউটারের পর্দা চালু আছে,কম্পিউটারের পর্দা চালু আছে,False,none,1.0,"The Bengali translation is a correct and natural representation of the English caption, maintaining the intended meaning without any errors.",കമ്പ്യൂട്ടർ സ്ക്രീനുകൾ ഓണാക്കി,കമ്പ്യൂട്ടർ സ്ക്രീനുകൾ ഓണാക്കി,False,none,1.0,"The translation is accurate and natural, effectively representing the meaning of the English caption without any issues.",କମ୍ପ୍ୟୁଟର ସ୍କ୍ରିନ୍ ଅନ୍ ହୋଇଗଲା |,କମ୍ପ୍ୟୁଟର ସ୍କ୍ରିନ୍ ଅନ୍ ହୋଇଗଲା |,False,none,1.0,The translation is accurate and captures the meaning of the original English caption without any errors or ambiguities.
18,664,241,93,126,man has short hair,आदमी के छोटे बाल हैं,आदमी के छोटे बाल हैं,False,none,1.0,"The Hindi caption ""आदमी के छोटे बाल हैं"" correctly reflects the meaning of the English caption ""man has short hair"" without any discrepancies.",মানুষের চুল ছোট,মানুষের চুল ছোট,False,none,1.0,The translation is accurate and maintains the intended meaning of the original English caption without any issues.,മനുഷ്യന് ചെറിയ മുടിയുണ്ട്,മനുഷ്യന് ചെറിയ മുടിയുണ്ട്,False,none,1.0,"The translation is accurate and natural, correctly reflecting the meaning of the English caption without any errors.",ମନୁଷ୍ୟର ଛୋଟ କେଶ ଅଛି |,ମନୁଷ୍ୟର ଛୋଟ କେଶ ଅଛି |,False,none,1.0,The translation is accurate and maintains the meaning of the original English caption without any errors or ambiguities.
21,1,113,120,138,photo album open on an adult's lap,एक वयस्क की गोद में फोटो एल्बम खुला,एक वयस्क की गोद में फोटो एल्बम खुला,False,none,1.0,The translation is precise and maintains the meaning of the original caption without any errors or ambiguities.,কোনও বয়স্কের কোলে ফটো অ্যালবাম খোলা,একটি প্রাপ্তবয়স্কের কোলে খোলা ফটো অ্যালবাম,True,visual_context_needed,0.8,"The translation uses ""elder,"" which may not accurately reflect the broader term ""adult"" used in the English caption, potentially leading to a misinterpretation of the age of the person in the image. Visual context is needed to confirm the age of the individual.",ഫോട്ടോ ആൽബം മുതിർന്നവരുടെ മടിയിൽ തുറക്കുന്നു,ഫോട്ടോ ആൽബം മുതിർന്നവരുടെ മടിയിൽ തുറക്കുന്നു,False,none,1.0,"The translation is accurate and natural, effectively capturing the meaning of the original English caption without any errors or ambiguities.",ବୟସ୍କଙ୍କ କୋଳରେ ଫଟୋ ଆଲବମ୍ ଖୋଲା ଅଛି |,ବୟସ୍କଙ୍କ କୋଳରେ ଫଟୋ ଆଲବମ୍ ଖୋଲା ଅଛି |,False,none,1.0,The translation is accurate and maintains the original meaning without any ambiguity or errors.
23,105,178,148,209,there is a group of girls beside the black car,काली कार के पास लड़कियों का एक समूह है,काली कार के पास लड़कियों का एक समूह है,False,none,1.0,The translation is accurate and maintains the original meaning without any errors or ambiguities.,কালো গাড়ির পাশে মেয়েদের একটি দল রয়েছে,কালো গাড়ির পাশে মেয়েদের একটি দল রয়েছে,False,none,1.0,The translation is accurate and maintains the meaning of the original English caption without any errors or omissions.,കറുത്ത കാറിനടുത്ത് ഒരു കൂട്ടം പെൺകുട്ടികളുണ്ട്,കറുത്ത കാറിനടുത്ത് ഒരു കൂട്ടം പെൺകുട്ടികളുണ്ട്,False,none,1.0,The translation is accurate and maintains the meaning of the original English caption without any errors or ambiguities.,କଳା କାର ପାଖରେ ଝିଅମାନଙ୍କର ଏକ ଦଳ ଅଛି |,କଳା କାର ପାଖରେ ଝିଅମାନଙ୍କର ଏକ ଦଳ ଅଛି |,False,none,1.0,The translation is accurate and captures the essence of the original English caption without any errors or omissions.
25,106,357,41,33,Child in a stroller,एक घुमक्कड़ में बच्चा,एक घुमक्कड़ में बच्चा,False,none,1.0,"The target caption is a correct translation of the English caption, maintaining the same meaning without any errors or ambiguities.",একটি স্ট্রলর মধ্যে শিশু,একটি স্ট্রলর মধ্যে শিশু,False,none,1.0,The translation is correct and conveys the same meaning as the English caption without any issues.,ഒരു ഉന്തുവണ്ടിയിലെ കുട്ടി,ഒരു ഉന്തുവണ്ടിയിലെ കുട്ടി,False,none,1.0,The translation is accurate and conveys the same meaning as the English caption without any errors or ambiguities.,ଏକ ବୁଲାବୁଲି ଗାଡ଼ିରେ ପିଲା |,ଏକ ବୁଲାବୁଲି ଗାଡ଼ିରେ ପିଲା |,False,none,1.0,The target caption correctly conveys the meaning of the English caption without any errors or ambiguities.
26,416,217,80,285,Tall metal lightpost,लंबा धातु प्रकाश पोस्ट,लंबा धातु प्रकाश पोस्ट,False,none,1.0,The translation is correct and conveys the same meaning as the original English caption without any errors or ambiguities.,লম্বা ধাতব লাইটপোস্ট,লম্বা ধাতব লাইটপোস্ট,False,none,1.0,The translation is correct and conveys the same meaning as the original English caption without any issues.,ഉയരമുള്ള മെറ്റൽ ലൈറ്റ്പോസ്റ്റ്,ഉയരമുള്ള മെറ്റൽ ലൈറ്റ്പോസ്റ്റ്,False,none,1.0,The translation is accurate and conveys the same meaning as the English caption without any issues.,ଲମ୍ବା ଧାତୁ ଲାଇଟପୋଷ୍ଟ |,ଲମ୍ବା ଧାତୁ ଲାଇଟପୋଷ୍ଟ |,False,none,1.0,The translation is correct and conveys the same meaning as the English caption without any errors or omissions.
27,158,210,112,51,wall is painted white,दीवार सफेद रंग की है,दीवार सफेद रंग की है,False,none,1.0,The Hindi translation correctly conveys the meaning of the English caption without any errors or ambiguities.,দেয়াল সাদা আঁকা হয়,দেয়াল সাদা আঁকা হয়,False,none,1.0,The translation is accurate and conveys the same meaning as the English caption without any errors or ambiguities.,മതിൽ വെളുത്ത ചായം പൂശി,മതിൽ വെളുത്ത ചായം പൂശി,False,none,1.0,The translation is accurate and conveys the same meaning as the English caption without any errors or ambiguities.,କାନ୍ଥ ଧଳା ରଙ୍ଗ ହୋଇଛି |,କାନ୍ଥକୁ ଧଳା ରଙ୍ଗ ଦିଆଯାଇଛି।,True,poor_translation,0.7,"While the target caption conveys the correct meaning about the wall being white, the use of ""କାନ୍ଥ"" is not appropriate for ""wall,"" which affects the overall clarity and accuracy of the translation."
28,19,18,772,339,there are several pictures on the wall,दीवार पर कई चित्र हैं,दीवार पर कई चित्र हैं,False,none,1.0,The Hindi translation correctly reflects the meaning of the English caption without any errors or ambiguities.,দেয়ালে বেশ কয়েকটি ছবি রয়েছে,দেয়ালে বেশ কয়েকটি ছবি রয়েছে,False,none,1.0,The Bengali translation correctly reflects the meaning of the English caption without any errors or ambiguities.,ചാരനിറത്തിലുള്ള റോഡിന്റെ വശങ്ങളിൽ പച്ച പുല്ലിന്റെ സ്ട്രിപ്പുകൾ,ചുമരിൽ നിരവധി ചിത്രങ്ങളുണ്ട്.,True,poor_translation,0.95,"The target caption fails to convey any aspect of the English caption, indicating a significant mistranslation. The content is entirely different, leading to a lack of relevance.",କାନ୍ଥରେ ଅନେକ ଚିତ୍ର ଅଛି |,କାନ୍ଥରେ ଅନେକ ଚିତ୍ର ଅଛି |,False,none,1.0,The translation is accurate and captures the meaning of the original English caption without any errors or ambiguities.
29,664,212,70,176,woman facing the ocean,सागर का सामना कर रही महिला,सागर का सामना कर रही महिला,False,none,1.0,"The Hindi caption ""सागर का सामना कर रही महिला"" correctly represents the English caption ""woman facing the ocean"" without any discrepancies.",মহিলা সমুদ্রের মুখোমুখি,মহিলা সমুদ্রের মুখোমুখি,False,none,1.0,The Bengali translation correctly reflects the meaning of the English caption without any errors or ambiguities.,സമുദ്രം അഭിമുഖീകരിക്കുന്ന സ്ത്രീ,സമുദ്രം അഭിമുഖീകരിക്കുന്ന സ്ത്രീ,False,none,1.0,The translation is accurate and captures the meaning of the original English caption without any issues.,ନାରୀ ସମୁଦ୍ର ମୁହାଁ ଠିଆ ହୋଇଛି|,ନାରୀ ସମୁଦ୍ର ମୁହାଁ ଠିଆ ହୋଇଛି|,False,none,1.0,The translation is accurate and captures the essence of the original English caption without any discrepancies.
35,28,4,760,589,this is an office layout,यह एक कार्यालय लेआउट है,यह एक कार्यालय लेआउट है,False,none,1.0,"The translation is a direct and accurate representation of the English caption, maintaining the intended meaning.",এটি একটি অফিস বিন্যাস,এটি একটি অফিস বিন্যাস,False,none,1.0,The translation is correct and conveys the same meaning as the original English caption without any errors or ambiguities.,ഇതൊരു ഓഫീസ് രേഖാചിത്രം,ഇതൊരു ഓഫീസ് രേഖാചിത്രം,False,none,1.0,The translation is precise and maintains the original meaning without any errors or awkward phrasing.,ଏହା ଏକ ଅଫିସ୍ ଲେଆଉଟ୍ |,ଏହା ଏକ ଅଫିସ୍ ଲେଆଉଟ୍ |,False,none,1.0,The translation is correct and conveys the same meaning as the original English caption without any errors or ambiguities.
38,175,453,604,290,four metallic chairs,चार धातु की कुर्सियाँ,चार धातु की कुर्सियाँ,False,none,1.0,The translation is accurate and conveys the same meaning as the English caption without any issues.,চারটি ধাতব চেয়ার,চারটি ধাতব চেয়ার,False,none,1.0,The translation is correct and conveys the same meaning as the English caption without any issues.,നാല് ലോഹത്തിന്റെ കസേരകൾ,നാല് ലോഹത്തിന്റെ കസേരകൾ,False,none,1.0,The translation is accurate and conveys the same meaning as the English caption without any issues.,ଚାରୋଟି ଧାତବ ଚେୟାର |,ଚାରୋଟି ଧାତବ ଚେୟାର |,False,none,1.0,The translation is correct and conveys the same meaning as the English caption without any errors or ambiguities.
39,478,227,225,77,Clutter is on a table,क्लटर एक मेज पर है,क्लटर एक मेज पर है,False,none,1.0,"The Hindi translation is a direct and accurate representation of the English caption, maintaining the intended meaning without any errors.",নড়বড়ে একটি টেবিলে আছে,একটি টেবিলে বিশৃঙ্খলা রয়েছে,True,poor_translation,0.9,"The translation fails to capture the essence of the original caption, which describes the presence of clutter rather than the condition of the table itself. This results in a significant deviation from the intended meaning.",കോലാഹലം ഒരു മേശപ്പുറത്താണ്,കോലാഹലം ഒരു മേശപ്പുറത്താണ്,False,none,1.0,The translation is accurate and conveys the same meaning as the English caption without any issues.,କ୍ଲଟର୍ ଏକ ଟେବୁଲ୍ ଉପରେ ଅଛି |,କ୍ଲଟର୍ ଏକ ଟେବୁଲ୍ ଉପରେ ଅଛି |,False,none,1.0,The target caption correctly conveys the meaning of the English caption without any errors or ambiguities.
41,368,244,329,225,a white microwave oven,एक सफेद माइक्रोवेव ओवन,एक सफेद माइक्रोवेव ओवन,False,none,1.0,"The translation is correct, complete, and natural, accurately reflecting the original English caption without any issues.",একটি সাদা মাইক্রোওয়েভ ওভেন,একটি সাদা মাইক্রোওয়েভ ওভেন,False,none,1.0,The translation is precise and conveys the same meaning as the English caption without any errors or omissions.,ഒരു വെളുത്ത മൈക്രോവേവ് ഓവൻ,ഒരു വെളുത്ത മൈക്രോവേവ് ഓവൻ,False,none,1.0,The translation is correct and conveys the same meaning as the English caption without any issues.,ଏକ ଧଳା ମାଇକ୍ରୋୱେଭ୍ ଚୁଲି |,ଏକ ଧଳା ମାଇକ୍ରୋୱେଭ୍ ଚୁଲି |,False,none,1.0,The translation is correct and conveys the same meaning as the English caption without any errors or ambiguities.
45,546,222,229,158,White SUV driving through intersection,चौराहे के माध्यम से सफेद एसयूवी ड्राइविंग,चौराहे के माध्यम से सफेद एसयूवी ड्राइविंग,False,none,1.0,The translation is clear and correctly represents the action and subject described in the English caption without any errors or ambiguities.,চৌরাস্তা দিয়ে হোয়াইট এসইউভি ড্রাইভিং,চৌরাস্তা দিয়ে হোয়াইট এসইউভি ড্রাইভিং,False,none,1.0,The translation is clear and correctly represents the action and description of the vehicle in the image.,കവലയിലൂടെ വൈറ്റ് എസ്‌യുവി ഡ്രൈവിംഗ്,ഇന്റർസെക്ഷൻ വഴി ഓടിക്കുന്ന വൈറ്റ് എസ്യുവി,True,poor_translation,0.8,"The target caption inaccurately adds the word ""arch,"" which is not mentioned in the English caption or visible in the image. This misrepresentation leads to a significant deviation from the original meaning.",ଛକ ଦେଇ ଧଳା ଏସ ଉ ଭି /ଏସୟୁଭି ଚାଳନା |,ହ୍ୱାଇଟ୍ ଏସ୍. ଯ଼ୁ. ଭି. ଇଣ୍ଟରସେକ୍ସନ୍ ଦେଇ ଗାଡ଼ି ଚଳାଉଛି,True,poor_translation,0.7,"The target caption fails to include the context of ""driving through intersection,"" which is a key part of the English caption. While it correctly identifies the vehicle as a white SUV, the omission of the intersection context makes it an incomplete translation."
47,500,278,150,153,Person crossing street with umbrella,छतरी के साथ सड़क पार करते व्यक्ति,छतरी के साथ सड़क पार करते व्यक्ति,False,none,1.0,"The Hindi translation is a direct and accurate representation of the English caption, maintaining the same meaning without any discrepancies.",ছাতা দিয়ে রাস্তা পার হওয়া ব্যক্তি,ছাতা দিয়ে রাস্তা পার হওয়া ব্যক্তি,False,none,1.0,"The Bengali translation is a direct and accurate representation of the English caption, maintaining the same meaning without any discrepancies.",കുടയുമായി തെരുവ് മുറിച്ചുകടക്കുന്ന വ്യക്തി,കുടയുമായി തെരുവ് മുറിച്ചുകടക്കുന്ന വ്യക്തി,False,none,1.0,The target caption correctly conveys the meaning of the English caption without any discrepancies or errors.,ଛତା ସହିତ ରାସ୍ତାରେ ଯାଉଥିବା ବ୍ୟକ୍ତି |,ଛତା ସହିତ ରାସ୍ତାରେ ଯାଉଥିବା ବ୍ୟକ୍ତି |,False,none,1.0,The translation is accurate and conveys the same meaning as the English caption without any discrepancies.
58,603,305,75,178,man in gray pants leaning on building,इमारत पर झुकाव में आदमी ग्रे पैंट में,इमारत पर झुकाव में आदमी ग्रे पैंट में,False,none,0.85,"The target caption accurately conveys the meaning of the English caption, but the phrasing could be improved for naturalness in Hindi.",ধূসর প্যান্টের লোকটি বিল্ডিংয়ের দিকে ঝুঁকছে,ধূসর প্যান্টের লোকটি বিল্ডিংয়ের দিকে ঝুঁকছে,False,none,1.0,The target caption accurately conveys the meaning of the English caption without any discrepancies or errors.,ചാരനിറത്തിലുള്ള പാന്റിലുള്ള മനുഷ്യൻ കെട്ടിടത്തിൽ ചാരിയിരിക്കുന്നു,ചാരനിറത്തിലുള്ള പാന്റിലുള്ള മനുഷ്യൻ കെട്ടിടത്തിൽ ചാരിയിരിക്കുന്നു,False,none,1.0,The translation is accurate and conveys the same meaning as the English caption without any discrepancies.,ଧୂସର ପ୍ୟାଣ୍ଟ ପିନ୍ଧିଥିବା ବ୍ୟକ୍ତି ବିଲଡିଂ ଉପରେ ନିର୍ଭରଶୀଳ |,ଧୂସର ପ୍ୟାଣ୍ଟ ପିନ୍ଧିଥିବା ବ୍ୟକ୍ତି ବିଲଡିଂ ଉପରେ ନିର୍ଭରଶୀଳ |,False,none,1.0,The translation is accurate and conveys the same meaning as the English caption without any discrepancies.
62,443,14,37,49,window on the building,भवन पर खिड़की,भवन पर खिड़की,False,none,1.0,The translation is accurate and conveys the same meaning as the English caption without any issues.,বিল্ডিং উইন্ডো,বিল্ডিং উইন্ডো,False,none,1.0,The translation is accurate and captures the essence of the original English caption without any issues.,ഒരു കെട്ടിടത്തിലെ വലിയ വിൻഡോ,കെട്ടിടത്തിലെ വിൻഡോ,True,visual_context_needed,0.7,"The target caption introduces a specific detail about the window being ""large,"" which cannot be verified from the image alone, leading to a potential misrepresentation of the original caption's meaning.",ବିଲଡିଂ ଉପରେ ୱିଣ୍ଡୋ |,ବିଲଡିଂ ଉପରେ ୱିଣ୍ଡୋ |,False,none,1.0,The translation is correct and captures the meaning of the original English caption without any issues.
65,360,57,145,169,A man standing in between cars,कारों के बीच में खड़ा एक आदमी,कारों के बीच में खड़ा एक आदमी,False,none,1.0,The Hindi caption correctly represents the English meaning without any discrepancies or errors.,গাড়ির মধ্যে দাঁড়িয়ে একজন লোক,গাড়ির মধ্যে দাঁড়িয়ে একজন লোক,False,none,1.0,The Bengali caption correctly reflects the meaning of the English caption without any errors or ambiguities.,കാറുകൾക്കിടയിൽ നിൽക്കുന്ന ഒരാൾ,കാറുകൾക്കിടയിൽ നിൽക്കുന്ന ഒരാൾ,False,none,1.0,"The translation is accurate and natural, effectively representing the original English caption without any issues.",କାର ମଧ୍ୟରେ ଛିଡା ହୋଇଥିବା ଜଣେ ବ୍ୟକ୍ତି |,କାର ମଧ୍ଯ଼ରେ ଠିଆ ହୋଇଥିବା ଜଣେ ବ୍ଯ଼କ୍ତି,True,poor_translation,0.7,"While the target caption conveys the general idea, the word ""ଛିଡା"" is not the most appropriate term to describe a person standing between cars, leading to a slightly awkward phrasing. A more natural expression would enhance clarity."
70,49,24,130,184,painting hanging on wall,दीवार पर चित्रकला,दीवार पर चित्रकला,False,none,1.0,The translation is accurate and conveys the same meaning as the English caption without any issues.,দেয়ালে ঝুলন্ত পেইন্টিং,দেয়ালে ঝুলন্ত পেইন্টিং,False,none,1.0,"The target caption is a direct and accurate translation of the English caption, conveying the same meaning without any discrepancies.",ചിത്രരചന ചുമരിൽ തൂക്കിയിരിക്കുന്നു,ചിത്രരചന ചുമരിൽ തൂക്കിയിരിക്കുന്നു,False,none,1.0,"The translation is accurate and natural, correctly reflecting the meaning of the English caption without any issues.",କାନ୍ଥରେ ଝୁଲୁଥିବା ଚିତ୍ର |,କାନ୍ଥରେ ଝୁଲୁଥିବା ଚିତ୍ରକଳା,True,poor_translation,0.7,"The target caption is a reasonable translation but lacks the specific detail that it is a painting, which is essential for accurately conveying the meaning of the English caption."
