image_id,x,y,width,height,english_caption,hindi_original,hindi_corrected,hindi_was_corrected,hindi_reason,hindi_confidence,hindi_explanation,bengali_original,bengali_corrected,bengali_was_corrected,bengali_reason,bengali_confidence,bengali_explanation,malayalam_original,malayalam_corrected,malayalam_was_corrected,malayalam_reason,malayalam_confidence,malayalam_explanation,odia_original,odia_corrected,odia_was_corrected,odia_reason,odia_confidence,odia_explanation
1688,52,254,228,66,White keyboard on top of desk.,डेस्क के ऊपर सफेद कीबोर्ड।,डेस्क के ऊपर सफेद कीबोर्ड।,False,none,1.0,"The Hindi translation is a direct and accurate representation of the English caption, maintaining the same meaning without any errors.",ডেস্কের উপরে সাদা কীবোর্ড।,ডেস্কের উপরে সাদা কীবোর্ড।,False,none,1.0,"The Bengali translation is a direct and accurate representation of the English caption, maintaining the same context and meaning without any errors.",ഒരു കെട്ടിടത്തിലെ വലിയ വിൻഡോ,മേശയുടെ മുകളിൽ വെളുത്ത കീബോർഡ്.,True,poor_translation,0.95,"The target caption completely misrepresents the content of the image, as it describes a window instead of a keyboard, indicating a significant translation error.",ଡେସ୍କ ଉପରେ ଧଳା କୀବୋର୍ଡ୍ |,ଡେସ୍କ ଉପରେ ଧଳା କୀବୋର୍ଡ୍ |,False,none,1.0,The translation is accurate and maintains the meaning of the original English caption without any errors or omissions.
1694,66,306,125,107,an old black tire,एक पुरानी काली टायर,एक पुराना काला टायर,True,poor_translation,0.7,"While the translation is accurate in meaning, the use of ""टायर"" may not be the most natural choice in everyday Hindi, which could lead to a perception of awkwardness in phrasing.",একটি পুরানো কালো টায়ার,একটি পুরানো কালো টায়ার,False,none,1.0,The translation is accurate and conveys the same meaning as the English caption without any issues.,ഒരു പഴയ കറുത്ത ടയർ,ഒരു പഴയ കറുത്ത ടയർ,False,none,1.0,"The translation is accurate and natural, correctly representing the original English caption without any issues.",ଏକ ପୁରୁଣା କଳା ଟାୟାର |,ଏକ ପୁରୁଣା କଳା ଟାୟାର |,False,none,1.0,"The target caption is a correct translation of the English caption, maintaining the same meaning without any discrepancies."
1695,328,155,153,108,Maroon SUV driving down the road,सड़क के नीचे जाती लाल रंग की एसयूवी,मरून एसयूवी सड़क पर चल रही है,True,poor_translation,0.8,"The translation fails to accurately convey the color of the SUV, which is maroon, not red. This misrepresentation affects the overall meaning of the caption.",রাস্তায় গাড়ি চালাচ্ছে মারুন এসইউভি,রাস্তায় গাড়ি চালাচ্ছে মারুন এসইউভি,False,none,1.0,The translation is accurate and maintains the meaning of the original English caption without any errors or omissions.,മെറൂൺ എസ്‌യുവി റോഡിലൂടെ ഓടിക്കുന്നു,മെറൂൺ എസ്‌യുവി റോഡിലൂടെ ഓടിക്കുന്നു,False,none,1.0,The translation is accurate and conveys the same meaning as the English caption without any errors or omissions.,ରାସ୍ତାରେ ଯାଉଥିବା ମାରୁନ୍ ଏସୟୁଭି |,ରାସ୍ତାରେ ଯାଉଥିବା ମାରୁନ୍ ଏସୟୁଭି |,False,none,1.0,The translation is precise and captures the essence of the original caption without any errors or omissions.
1698,616,346,91,155,a map hanging on the wall,दीवार पर लटका एक नक्शा,दीवार पर लटका एक नक्शा,False,none,1.0,The translation is precise and maintains the original meaning without any errors or ambiguities.,দেয়ালে ঝুলন্ত একটি মানচিত্র,দেয়ালে ঝুলন্ত একটি মানচিত্র,False,none,1.0,The translation is precise and maintains the original meaning without any ambiguity or errors.,ചുവരിൽ തൂക്കിയിട്ടിരിക്കുന്ന മാപ്പ്,ചുവരിൽ തൂക്കിയിട്ടിരിക്കുന്ന മാപ്പ്,False,none,1.0,The translation is precise and maintains the original meaning without any errors or ambiguities.,କାନ୍ଥରେ ଝୁଲୁଥିବା ଏକ ମାନଚିତ୍ର |,କାନ୍ଥରେ ଝୁଲୁଥିବା ଏକ ମାନଚିତ୍ର |,False,none,1.0,The translation is accurate and conveys the same meaning as the English caption without any errors or ambiguities.
1701,131,0,468,44,fluorescent ceiling lights,फ्लोरोसेंट छत रोशनी,फ्लोरोसेंट छत रोशनी,False,none,1.0,The translation is correct and conveys the same meaning as the original English caption without any errors or ambiguities.,ফ্লুরোসেন্ট সিলিং লাইট,ফ্লুরোসেন্ট সিলিং লাইট,False,none,1.0,The translation is direct and correctly conveys the original meaning without any errors or ambiguities.,ഫ്ലോറസന്റ് സീലിംഗ് ലൈറ്റുകൾ,ഫ്ലോറസന്റ് സീലിംഗ് ലൈറ്റുകൾ,False,none,1.0,The translation is accurate and conveys the same meaning as the English caption without any errors or ambiguities.,ଫ୍ଲୋରୋସେଣ୍ଟ୍ ସିଲିଂ ଲାଇଟ୍ |,ଫ୍ଲୋରୋସେଣ୍ଟ୍ ସିଲିଂ ଲାଇଟ୍ |,False,none,1.0,The translation is correct and conveys the same meaning as the English caption without any errors or ambiguities.
1702,112,180,202,108,a tan wooden desk,एक लकड़ी की मेज,एक तन लकड़ी की मेज़,True,poor_translation,0.7,"The translation is incomplete as it fails to convey the specific color (""tan"") and the type of furniture (""desk"") mentioned in the English caption. It only refers to a general ""wooden table,"" which does not accurately represent the original meaning.",একটি ট্যান কাঠের ডেস্ক,একটি ট্যান কাঠের ডেস্ক,False,none,1.0,The translation is correct and conveys the same meaning as the English caption without any errors or ambiguities.,ഒരു തടി മരം,ഒരു ടാൻ തടി മേശ,True,poor_translation,0.8,"The target caption fails to specify that it is a desk and only refers to wood, which does not match the original English caption's meaning.",ଏକ ଟାନ୍ କାଠ ଡେସ୍କ |,ଏକ ଟାନ୍ କାଠ ଡେସ୍କ |,False,none,1.0,The translation is correct and conveys the same meaning as the English caption without any errors or ambiguities.
1704,2,4,637,474,the blue walls,नीली दीवारों,नीली दीवारों,False,none,1.0,The translation is accurate and conveys the same meaning as the English caption without any errors or ambiguities.,নীল দেয়াল,নীল দেয়াল,False,none,1.0,The translation is accurate and conveys the same meaning as the English caption without any issues.,നീല മതിലുകൾ,നീല മതിലുകൾ,False,none,1.0,The translation is accurate and conveys the same meaning as the English caption without any issues.,ନୀଳ କାନ୍ଥ,ନୀଳ କାନ୍ଥ,True,poor_translation,0.8,"The translation is mostly accurate but fails to capture the plural aspect of ""walls,"" which is important for a precise translation."
1709,287,172,66,116,large window with white sill,सफेद खिड़की के साथ बड़ी खिड़की,सफेद सिल के साथ बड़ी खिड़की,True,poor_translation,0.8,"The translation is awkward due to the repetition of ""खिड़की"" (window), making it sound unnatural. A more fluid translation would avoid this redundancy while still conveying the same meaning.",সাদা সিল সঙ্গে বড় উইন্ডো,সাদা সিল সঙ্গে বড় উইন্ডো,False,none,1.0,The translation is accurate and conveys the same meaning as the English caption without any errors or omissions.,വെളുത്ത ഡിസിയുടെ വലിയ വിൻഡോ,വെളുത്ത സിൽ ഉള്ള വലിയ ജനാല,True,poor_translation,0.8,"The translation fails to accurately convey the specific term ""sill,"" leading to a misunderstanding of the window's description. The use of ""design"" instead of ""sill"" alters the intended meaning.",ଧଳା ସିଲ୍ ସହିତ ବଡ଼ ୱିଣ୍ଡୋ |,ଧଳା ସିଲ୍ ସହିତ ବଡ଼ ୱିଣ୍ଡୋ |,False,none,1.0,The translation is correct and conveys the same meaning as the English caption without any errors or omissions.
1711,44,32,45,60,red street sign with white lettering,लाल स्ट्रीट लाल चिह्न सफेद पट्टी के साथ,सफेद अक्षरों के साथ लाल सड़क का संकेत,True,poor_translation,0.8,"The translation contains inaccuracies and awkward phrasing, failing to convey the meaning of the original English caption accurately. The repetition of ""लाल"" and the use of ""चिह्न"" instead of a more appropriate term for a street sign contribute to the poor translation.",সাদা বর্ণের সাথে লাল রাস্তার চিহ্ন sign,সাদা অক্ষর সহ লাল রাস্তার চিহ্ন,True,poor_translation,0.8,"The translation is mostly accurate but includes an unnecessary word that makes it slightly awkward. A more natural phrasing would omit ""চিহ্ন"" to simply state ""লাল রাস্তার চিহ্ন"" (red street sign).",വെളുത്ത അക്ഷരങ്ങളുള്ള ചുവന്ന തെരുവ് ചിഹ്നം,വെളുത്ത അക്ഷരങ്ങളുള്ള ചുവന്ന തെരുവ് ചിഹ്നം,False,none,1.0,The translation is accurate and conveys the same meaning as the English caption without any discrepancies.,ଧଳା ଅକ୍ଷର ସହିତ ନାଲି ରାସ୍ତାର ଚିହ୍ନ |,ଧଳା ଅକ୍ଷର ସହିତ ଲାଲ ରାସ୍ତାର ଚିହ୍ନ,True,poor_translation,0.7,"The target caption fails to include the critical details about the sign's color and its specific purpose, leading to an incomplete representation of the original English caption."
1714,559,325,26,36,a red sign with a white stripe,एक सफेद पट्टी के साथ एक लाल संकेत,एक सफेद पट्टी के साथ एक लाल संकेत,False,none,1.0,The translation is accurate and conveys the same meaning as the English caption without any errors or ambiguities.,একটি সাদা ফিতে সঙ্গে একটি লাল চিহ্ন,একটি সাদা ফিতে সঙ্গে একটি লাল চিহ্ন,False,none,1.0,The target caption correctly conveys the meaning of the English caption without any discrepancies or errors.,വെളുത്ത വരയുള്ള ചുവന്ന ചിഹ്നം,വെളുത്ത വരയുള്ള ചുവന്ന ചിഹ്നം,False,none,1.0,The translation is accurate and conveys the same meaning as the English caption without any discrepancies.,ଏକ ଧଳା ରେଖା ସହିତ ଏକ ଲାଲ୍ ଚିହ୍ନ |,ଏକ ଧଳା ରେଖା ସହିତ ଏକ ଲାଲ୍ ଚିହ୍ନ |,False,none,1.0,The target caption correctly conveys the meaning of the English caption without any discrepancies or errors.
1716,623,336,174,90,car driving on road,सड़क पर कार चलाना,सड़क पर कार चलाना,False,none,1.0,The translation is accurate and conveys the same meaning as the English caption without any issues.,রাস্তায় গাড়ি চালানো,রাস্তায় গাড়ি চালানো,False,none,1.0,The translation is accurate and conveys the same meaning as the English caption without any issues.,റോഡിൽ കാർ ഡ്രൈവിംഗ്,റോഡിൽ കാർ ഡ്രൈവിംഗ്,False,none,1.0,The translation is accurate and conveys the same meaning as the English caption without any errors or ambiguities.,ରାସ୍ତାରେ କାର ଚାଳନା |,ରାସ୍ତାରେ କାର ଚାଳନା |,False,none,1.0,The translation is accurate and captures the meaning of the original English caption without any errors or ambiguities.
1718,145,153,61,101,blue banner with white decorations,सफेद सजावट के साथ नीला बैनर,सफेद सजावट के साथ नीला बैनर,False,none,1.0,The target caption correctly conveys the meaning of the English caption without any discrepancies.,সাদা সজ্জা সঙ্গে নীল ব্যানার,সাদা সজ্জা সঙ্গে নীল ব্যানার,False,none,1.0,"The target caption correctly describes the image as a blue banner with white decorations, matching the English caption perfectly.",വെളുത്ത അലങ്കാരങ്ങളുള്ള നീല ബാനർ,വെളുത്ത അലങ്കാരങ്ങളുള്ള നീല ബാനർ,False,none,1.0,The translation is accurate and conveys the same meaning as the English caption without any discrepancies.,ଧଳା ସାଜସଜ୍ଜା ସହିତ ନୀଳ ବ୍ୟାନର |,ଧଳା ସାଜସଜ୍ଜା ସହିତ ନୀଳ ବ୍ଯ଼ାନର,True,poor_translation,0.8,"The target caption incorrectly describes the color of the banner by using ""ଧଳା"" (white) instead of accurately stating that the banner is blue with white decorations. This misrepresentation affects the overall accuracy of the translation."
1719,320,318,48,166,black railingon the sidewalk,काला रेलिंगोन सिडीचलन,फुटपाथ पर काली रेलिंग,True,poor_translation,0.2,"The target caption contains incorrect and unnatural phrasing, failing to accurately convey the meaning of the English caption. The terms used do not properly represent the objects described in the image.",ব্ল্যাক রেলিংগন ফুটপাত,রাস্তার পাশে কালো রেলিং,True,poor_translation,0.8,"The translation is mostly accurate but contains a spelling error in the word for ""railing,"" which affects the overall quality of the translation.",കറുത്ത റെയിലിംഗ് പാതയോരത്ത്,കറുത്ത റെയിലിംഗ് പാതയോരത്ത്,False,none,1.0,The translation is accurate and maintains the original meaning without any errors or ambiguities.,ରାସ୍ତା କଡ଼ରେ କଳା ରେଲିଂ |,ରାସ୍ତା କଡ଼ରେ କଳା ରେଲିଂ |,False,none,1.0,The translation is accurate and maintains the meaning of the original English caption without any errors or omissions.
1722,61,141,27,19,Person on the surfboard,सर्फ़बोर्ड पर व्यक्ति,सर्फ़बोर्ड पर व्यक्ति,False,none,1.0,The translation is accurate and conveys the same meaning as the English caption without any issues.,সার্ফবোর্ডে থাকা ব্যক্তি,সার্ফবোর্ডে থাকা ব্যক্তি,False,none,1.0,The translation is precise and maintains the original meaning without any ambiguity or errors.,സർഫ്ബോർഡിലെ വ്യക്തി,സർഫ്ബോർഡിലെ വ്യക്തി,False,none,1.0,The translation is accurate and conveys the same meaning as the English caption without any issues.,ସର୍ଫବୋର୍ଡରେ ଥିବା ବ୍ୟକ୍ତି |,ସର୍ଫବୋର୍ଡରେ ଥିବା ବ୍ୟକ୍ତି |,False,none,1.0,The translation is accurate and maintains the meaning of the original English caption without any errors or ambiguities.
1727,92,148,23,14,Boat in the water,पानी में नाव,पानी में नाव,False,none,1.0,The translation is accurate and conveys the same meaning as the English caption without any issues.,জলে নৌকা,জলে নৌকা,False,none,1.0,The translation is accurate and conveys the same meaning as the English caption without any issues.,വർണ്ണാഭമായ സ്കാർഫ് ധരിച്ച ഒരു സ്ത്രീ,വെള്ളത്തിൽ ബോട്ട്,True,poor_translation,0.95,"The target caption does not represent the content of the image at all, as it describes a person rather than a boat. This indicates a significant mistranslation.",ପାଣିରେ ଡଙ୍ଗା |,ପାଣିରେ ଡଙ୍ଗା |,False,none,1.0,The translation is accurate and conveys the same meaning as the English caption without any issues.
1730,1,124,133,106,a row of parked cars,खड़ी कारों की एक पंक्ति,खड़ी कारों की एक पंक्ति,False,none,1.0,The translation is precise and maintains the original meaning without any errors or awkward phrasing.,পার্ক করা গাড়িগুলির একটি সারি,পার্ক করা গাড়িগুলির একটি সারি,False,none,1.0,The translation is precise and maintains the original meaning without any errors or ambiguities.,പാർക്ക് ചെയ്തിരിക്കുന്ന കാറുകളുടെ ഒരു നിര,പാർക്ക് ചെയ്തിരിക്കുന്ന കാറുകളുടെ ഒരു നിര,False,none,1.0,The translation is precise and maintains the original meaning without any ambiguity or errors.,ପାର୍କିଂ କାରଗୁଡିକର ଏକ ଧାଡି |,ପାର୍କିଂ କାରଗୁଡିକର ଏକ ଧାଡି |,False,none,1.0,The translation is accurate and captures the meaning of the original English caption without any errors or ambiguities.
1735,60,256,122,90,a black computer monitor,एक काला कंप्यूटर मॉनीटर,एक काला कंप्यूटर मॉनीटर,False,none,1.0,"The translation is correct, complete, and natural, accurately reflecting the original English caption without any issues.",একটি কালো কম্পিউটার মনিটর,একটি কালো কম্পিউটার মনিটর,False,none,1.0,"The translation is correct, complete, and natural, accurately reflecting the original English caption without any issues.",ഒരു കറുത്ത കമ്പ്യൂട്ടർ മോണിറ്റർ,ഒരു കറുത്ത കമ്പ്യൂട്ടർ മോണിറ്റർ,False,none,1.0,The translation is correct and conveys the same meaning as the English caption without any issues.,ଏକ କଳା କମ୍ପ୍ୟୁଟର ମନିଟର |,ଏକ କଳା କମ୍ପ୍ୟୁଟର ମନିଟର |,False,none,1.0,The translation is accurate and conveys the same meaning as the English caption without any errors or omissions.
1736,56,52,199,107,multicolored rainbow over water,पानी के ऊपर बहु रंगीन इंद्रधनुष,पानी के ऊपर बहु रंगीन इंद्रधनुष,False,none,1.0,The translation is accurate and captures the essence of the original English caption without any errors or omissions.,জলের উপরে বহু রঙের রংধনু,জলের উপরে বহু রঙের রংধনু,False,none,1.0,The translation is accurate and captures the essence of the original English caption without any errors or omissions.,6thവെള്ളത്തിന് മുകളിലുള്ള വർണ്ണ മഴവില്ല്,വെള്ളത്തിന് മുകളിൽ വർണ്ണാഭമായ മഴവില്ല്,True,poor_translation,0.7,"The inclusion of ""6th"" in the target caption is confusing and does not correspond to the English caption, which simply describes a multicolored rainbow over water. This affects the overall clarity and accuracy of the translation.",ଜଳ ଉପରେ ବହୁ ରଙ୍ଗର ଇନ୍ଦ୍ରଧନୁ |,ଜଳ ଉପରେ ବହୁ ରଙ୍ଗର ଇନ୍ଦ୍ରଧନୁ |,False,none,1.0,The translation is accurate and captures the essence of the original English caption without any errors or omissions.
1738,217,147,36,49,The hedges to the right,हेज करने के लिए सही है,दाहिनी ओर बाड़,True,poor_translation,0.9,"The target caption misinterprets the original meaning, failing to indicate the position of the hedges as stated in the English caption. Instead, it suggests a purpose or suitability for hedging, which is not relevant to the context.",ডানদিকে হেজেস,ডানদিকে হেজেস,True,poor_translation,0.7,"While the translation captures the direction and the subject, the use of ""হেজেস"" is not a natural Bengali term. A more appropriate term would enhance the translation's quality and fluency.",വലതുവശത്തുള്ള വേലി,വലതുവശത്തുള്ള വേലി,False,none,1.0,The translation is accurate and conveys the same meaning as the English caption without any issues.,ଡାହାଣ ପାର୍ଶ୍ୱରେ ଥିବା ହେଜ୍ |,ଡାହାଣ ପାର୍ଶ୍ୱରେ ଥିବା ହେଜ୍ |,False,none,1.0,The translation is accurate and conveys the same meaning as the English caption without any errors or ambiguities.
1741,183,193,50,43,a coffee cup on a table,एक मेज पर एक कॉफी कप,एक मेज पर एक कॉफी कप,False,none,1.0,The translation is correct and maintains the meaning of the original English caption without any errors or ambiguities.,একটি টেবিলের উপর একটি কফি কাপ,একটি টেবিলের উপর একটি কফি কাপ,False,none,1.0,The Bengali translation correctly reflects the meaning of the English caption without any errors or ambiguities.,ഒരു മേശപ്പുറത്ത് ഒരു കോഫി കപ്പ്,ഒരു മേശപ്പുറത്ത് ഒരു കോഫി കപ്പ്,False,none,1.0,"The translation is accurate and natural, correctly representing the content of the image as described in the English caption.",ଏକ ଟେବୁଲ ଉପରେ ଏକ କଫି କପ୍ |,ଏକ ଟେବୁଲ ଉପରେ ଏକ କଫି କପ୍ |,False,none,1.0,The translation is correct and captures the meaning of the original English caption without any errors or ambiguities.
1742,211,13,27,99,street light is off,स्ट्रीट लाइट बंद है,स्ट्रीट लाइट बंद है,False,none,1.0,The translation is correct and conveys the same meaning as the English caption without any errors or ambiguities.,স্ট্রিট লাইট বন্ধ,স্ট্রিট লাইট বন্ধ,False,none,1.0,The translation is correct and conveys the same meaning as the English caption without any issues.,തെരുവ് വിളക്ക് അണഞ്ഞതാണ്,തെരുവ് വിളക്ക് അണഞ്ഞതാണ്,False,none,1.0,The target caption correctly conveys the meaning of the English caption without any errors or ambiguities.,ଷ୍ଟ୍ରିଟ୍ ଲାଇଟ୍ ବନ୍ଦ ଅଛି |,ଷ୍ଟ୍ରିଟ୍ ଲାଇଟ୍ ବନ୍ଦ ଅଛି |,False,none,1.0,The translation is correct and conveys the same meaning as the English caption without any errors or ambiguities.
