image_id,x,y,width,height,english_caption,hindi_original,hindi_corrected,hindi_was_corrected,hindi_reason,hindi_confidence,hindi_explanation,bengali_original,bengali_corrected,bengali_was_corrected,bengali_reason,bengali_confidence,bengali_explanation,malayalam_original,malayalam_corrected,malayalam_was_corrected,malayalam_reason,malayalam_confidence,malayalam_explanation,odia_original,odia_corrected,odia_was_corrected,odia_reason,odia_confidence,odia_explanation
1171,160,211,100,110,child shopping cart filled with fake food,बाल शॉपिंग गाड़ी से भरा हुआ भोजन,नकली भोजन से भरा बाल खरीदारी कार्ट,True,poor_translation,0.8,"The target caption fails to convey that the food is fake, which is a crucial detail in the English caption. This results in an incomplete translation that does not accurately represent the original meaning.",শিশু শপিং কার্ট জাল খাবার দিয়ে ভরা,শিশু শপিং কার্ট জাল খাবার দিয়ে ভরা,False,none,1.0,The translation is accurate and captures the meaning of the original English caption without any errors or omissions.,വ്യാജ ഭക്ഷണം നിറച്ച ചൈൽഡ് ഷോപ്പിംഗ് കാർട്ട്,വ്യാജ ഭക്ഷണം നിറച്ച ചൈൽഡ് ഷോപ്പിംഗ് കാർട്ട്,False,none,1.0,The translation is accurate and captures the essence of the original English caption without any errors or omissions.,ନକଲି ଖାଦ୍ୟରେ ଭରପୂର ଶିଶୁ ସପିଂ କାର୍ଟ |,ନକଲି ଖାଦ୍ୟରେ ଭରପୂର ଶିଶୁ ସପିଂ କାର୍ଟ |,False,none,1.0,"The target caption is a precise translation of the English caption, effectively conveying the same meaning without any errors or omissions."
1175,52,56,729,498,this is a kitchen,यह एक रसोई है,यह एक रसोई है,False,none,1.0,The translation is correct and conveys the same meaning as the original English caption without any issues.,এটি একটি রান্নাঘর,এটি একটি রান্নাঘর,False,none,1.0,The translation is correct and conveys the same meaning as the original English caption without any issues.,ഇതൊരു അടുക്കളയാണ്,ഇതൊരു അടുക്കളയാണ്,False,none,1.0,The translation is correct and conveys the same meaning as the English caption without any issues.,ଏହା ଏକ ରୋଷେଇ ଘର |,ଏହା ଏକ ରୋଷେଇ ଘର |,False,none,1.0,The translation from English to Odia is accurate and maintains the intended meaning without any errors or ambiguities.
1176,46,290,48,48,a faucet on the sink,सिंक पर एक नल,सिंक पर एक नल,False,none,1.0,The translation is precise and conveys the same meaning as the English caption without any errors or ambiguities.,ডুবে একটি কল,সিঙ্কের উপর একটি কল,True,poor_translation,0.8,"The translation misrepresents the spatial relationship indicated in the English caption by using ""in"" instead of ""on,"" leading to a significant difference in meaning.",സിങ്കിൽ ഒരു പാത്രം,സിങ്കിൽ ഒരു കുഴൽ,True,poor_translation,0.9,"The translation misrepresents the object in the image, referring to a vessel instead of the faucet, leading to a significant misunderstanding of the visual context.",ସିଙ୍କ ଉପରେ ଏକ କଳସ |,ସିଙ୍କ ଉପରେ ଏକ ନଳ,True,poor_translation,0.9,"The target caption incorrectly identifies the object as a pitcher instead of a faucet, leading to a significant mistranslation of the original meaning."
1177,428,8,64,65,Assorted cereals on a kitchen shelf,एक रसोई के शेल्फ पर अनाज रखा,एक रसोईघर के अलमारियों पर मिश्रित अनाज,True,poor_translation,0.7,"The translation is incomplete as it fails to convey the variety implied by ""assorted cereals,"" leading to a loss of specificity in the meaning.",রান্নাঘরের শেল্ফে বিভিন্ন ধরণের সিরিয়াল,রান্নাঘরের শেল্ফে বিভিন্ন ধরণের সিরিয়াল,False,none,1.0,"The translation is clear and correctly represents the content of the image, maintaining the meaning of the original English caption.",അടുക്കള അലമാരയിൽ തരംതിരിച്ച ധാന്യങ്ങൾ,അടുക്കള ഷെൽഫിൽ വിവിധതരം ധാന്യങ്ങൾ,True,poor_translation,0.7,"The translation uses ""grains"" instead of ""cereals,"" which may lead to a misunderstanding of the specific items depicted in the image. While the context of a kitchen shelf is maintained, the specific type of food is not accurately conveyed.",ଏକ ରୋଷେଇ ଘରର ସେଲରେ ବିଭିନ୍ନ ପ୍ରକାରର ଶସ୍ୟ |,ଏକ ରୋଷେଇ ଘର ଛପର ଉପରେ ବିଭିନ୍ନ ପ୍ରକାରର ଖାଦ୍ଯ଼ଶସ୍ଯ଼,True,poor_translation,0.7,"The translation uses a broader term ""grains"" instead of the more specific ""cereals,"" which could lead to a misunderstanding of the image's content. This results in a loss of specificity from the original English caption."
1178,365,274,158,122,white microwave oven in corner,कोने में सफेद माइक्रोवेव ओवन,कोने में सफेद माइक्रोवेव ओवन,False,none,1.0,"The Hindi translation correctly conveys the description of a ""white microwave oven in corner"" without any errors or omissions.",কোণে সাদা মাইক্রোওয়েভ ওভেন,কোণে সাদা মাইক্রোওয়েভ ওভেন,False,none,1.0,The translation is correct and conveys the same meaning as the English caption without any errors or omissions.,മൂലയിൽ വെളുത്ത മൈക്രോവേവ് ഓവൻ,മൂലയിൽ വെളുത്ത മൈക്രോവേവ് ഓവൻ,True,poor_translation,0.8,"The translation includes an additional word ""മൂലയിൽ"" (in the corner) that is not present in the English caption, which could mislead the interpretation of the image's context. The core elements are correct, but the extra detail makes it a poor translation.",କୋଣରେ ଧଳା ମାଇକ୍ରୋୱେଭ୍ ଚୁଲି |,କୋଣରେ ଧଳା ମାଇକ୍ରୋୱେଭ୍ ଚୁଲି |,False,none,1.0,The translation is accurate and conveys the same meaning as the English caption without any discrepancies.
1180,0,150,265,116,wall papered wall in a kitchen,एक रसोई घर में दीवार papered दीवार,एक रसोईघर में दीवार की छतरीदार दीवार,True,poor_translation,0.7,"The target caption contains a grammatical error and awkward phrasing, making it sound unnatural in Hindi. A more fluent translation would improve clarity and readability.",একটি রান্নাঘর মধ্যে ওয়াল পেপার লাগানো প্রাচীর,একটি রান্নাঘর মধ্যে ওয়াল পেপার লাগানো প্রাচীর,False,none,1.0,The translation is accurate and conveys the same meaning as the English caption without any discrepancies or errors.,ഒരു അടുക്കളയിൽ മതിൽ പേപ്പർ ചെയ്ത മതിൽ,ഒരു അടുക്കളയിൽ മതിൽ പേപ്പർ ചെയ്ത മതിൽ,False,none,1.0,The translation is accurate and maintains the meaning of the original English caption without any errors or ambiguities.,ରୋଷେଇ ଘରେ କାନ୍ଥ ପେପର କାନ୍ଥ |,ରୋଷେଇ ଘରେ କାନ୍ଥ ପେପର କାନ୍ଥ |,False,none,1.0,The target caption correctly conveys the meaning of the English caption without any errors or omissions.
1194,3,0,492,299,A wall of orange dryers.,नारंगी ड्रायर्स की एक दीवार,नारंगी ड्रायर्स की एक दीवार,False,none,1.0,"The Hindi translation ""नारंगी ड्रायर्स की एक दीवार"" correctly represents the English caption ""A wall of orange dryers"" without any discrepancies.",কমলা ড্রায়ারের একটি প্রাচীর,কমলা ড্রায়ারের একটি প্রাচীর,False,none,1.0,The translation is precise and maintains the original meaning without any ambiguity or errors.,ഓറഞ്ച് ഡ്രയറുകളുടെ ഒരു മതിൽ.,ഓറഞ്ച് ഡ്രയറുകളുടെ ഒരു മതിൽ.,False,none,1.0,The translation is precise and maintains the original meaning without any errors or awkward phrasing.,କମଳା ଶୁଖୁଆର କାନ୍ଥ |,କମଳା ଡ୍ରାଯ଼ର୍ ର ଏକ କାନ୍ଥ |,True,poor_translation,0.8,"The translation does not capture the plural aspect and the concept of a ""wall"" present in the original caption, leading to a significant misrepresentation of the image's context."
1195,36,37,200,76,White pipe on the wall,दीवार पर सफेद पाइप,दीवार पर सफेद पाइप,False,none,1.0,The translation is correct and conveys the same meaning as the English caption without any issues.,দেয়ালে সাদা পাইপ,দেয়ালে সাদা পাইপ,False,none,1.0,The translation is accurate and conveys the same meaning as the English caption without any issues.,ചുമരിൽ വെളുത്ത പൈപ്പ്,ചുമരിൽ വെളുത്ത പൈപ്പ്,False,none,1.0,The translation is accurate and maintains the original meaning without any errors or ambiguities.,କାନ୍ଥରେ ଧଳା ପାଇପ୍ |,କାନ୍ଥରେ ଧଳା ପାଇପ,True,poor_translation,0.9,"The translation misrepresents the location of the pipe, changing ""on the wall"" to ""in the throat,"" which is a significant error in meaning."
1196,365,44,179,291,dolphin statue near the pool,पूल के निकट डॉल्फिन,पूल के पास डॉल्फिन की मूर्ति,True,poor_translation,0.7,"The translation misses the crucial detail that the dolphins are part of a statue, leading to an incomplete representation of the original caption. The phrase ""डॉल्फिन"" alone does not specify that it refers to a statue.",পুলের কাছে ডলফিন স্ট্যাচু,পুলের কাছে ডলফিন স্ট্যাচু,False,none,1.0,The Bengali translation correctly reflects the meaning of the English caption without any errors or omissions.,കുളത്തിനടുത്തുള്ള ഡോൾഫിൻ പ്രതിമ,കുളത്തിനടുത്തുള്ള ഡോൾഫിൻ പ്രതിമ,False,none,1.0,The translation is precise and maintains the meaning of the original English caption without any errors or ambiguities.,ପୁଷ୍କରିଣୀ ନିକଟରେ ଡଲଫିନ୍ ପ୍ରତିମୂର୍ତ୍ତି |,ପୁଷ୍କରିଣୀ ନିକଟରେ ଡଲଫିନ୍ ପ୍ରତିମୂର୍ତ୍ତି |,False,none,1.0,The translation is accurate and conveys the same meaning as the English caption without any errors or omissions.
1202,487,290,81,54,microwave on top of counter,काउंटर के ऊपर माइक्रोवेव,काउंटर के ऊपर माइक्रोवेव,False,none,1.0,"The Hindi translation is a direct and accurate representation of the English caption, with no issues in translation or context.",কাউন্টার উপরে মাইক্রোওয়েভ,কাউন্টার উপরে মাইক্রোওয়েভ,False,none,1.0,The translation is direct and maintains the meaning of the original caption without any errors or ambiguities.,ക counter ണ്ടറിന് മുകളിൽ മൈക്രോവേവ്,ക counter ണ്ടറിന് മുകളിൽ മൈക്രോവേവ്,False,none,1.0,The translation is accurate and conveys the same meaning as the English caption without any errors or ambiguities.,କାଉଣ୍ଟର ଉପରେ ମାଇକ୍ରୋୱେଭ୍ |,କାଉଣ୍ଟର ଉପରେ ମାଇକ୍ରୋୱେଭ୍ |,False,none,1.0,"The translation is accurate and natural, correctly representing the information in the English caption without any errors."
1211,259,128,36,25,logo on the hat,टोपी पर लोगो,टोपी पर लोगो,False,none,1.0,The translation is correct and conveys the same meaning as the English caption without any issues.,টুপি লোগো,টুপি লোগো,False,none,1.0,The translation is accurate and captures the essence of the original English caption without any errors or omissions.,തൊപ്പിയിലെ അടയാളം,തൊപ്പിയിലെ അടയാളം,False,none,1.0,The translation accurately reflects the meaning of the English caption without any discrepancies or errors.,ଟୋପି ଉପରେ ଲୋଗୋ |,ଟୋପି ଉପରେ ଲୋଗୋ |,False,none,1.0,The translation is accurate and maintains the meaning of the original English caption without any errors or ambiguities.
1212,18,230,172,165,a person kneeling down,एक व्यक्ति ने घुटने टेक दिए,एक व्यक्ति ने घुटने टेक दिए,False,none,1.0,"The target caption correctly represents the action of the person in the image, aligning well with the English caption.",একজন ব্যক্তি হাঁটু গেড়ে বসে,একজন ব্যক্তি হাঁটু গেড়ে বসে,False,none,1.0,The Bengali translation correctly reflects the action described in the English caption without any discrepancies or omissions.,ഒരാൾ മുട്ടുകുത്തി നിൽക്കുന്നു,ഒരാൾ മുട്ടുകുത്തി നിൽക്കുന്നു,False,none,1.0,"The translation is accurate and conveys the same meaning as the English caption, correctly describing the action of the person in the image.",ଜଣେ ବ୍ୟକ୍ତି ଆଣ୍ଠୁମାଡି ବସିଛନ୍ତି |,ଜଣେ ବ୍ୟକ୍ତି ଆଣ୍ଠୁମାଡି ବସିଛନ୍ତି |,False,none,1.0,The target caption correctly conveys the meaning of the English caption by accurately describing the action of the person in the image.
1214,158,256,101,241,Person wearing black pants,व्यक्ति ने काला पैंट पहना है,व्यक्ति ने काला पैंट पहना है,False,none,1.0,"The translation is accurate and natural, correctly reflecting the content of the image and the meaning of the English caption.",কালো প্যান্ট পরা ব্যক্তি,কালো প্যান্ট পরা ব্যক্তি,False,none,1.0,The Bengali translation correctly reflects the meaning of the English caption without any errors or omissions.,കറുത്ത പാന്റ്സ് ധരിച്ച വ്യക്തി,കറുത്ത പാന്റ്സ് ധരിച്ച വ്യക്തി,False,none,1.0,"The translation is accurate and natural, correctly reflecting the content of the image and the meaning of the English caption.",କଳା ପ୍ୟାଣ୍ଟ ପିନ୍ଧିଥିବା ବ୍ୟକ୍ତି |,କଳା ପ୍ୟାଣ୍ଟ ପିନ୍ଧିଥିବା ବ୍ୟକ୍ତି |,False,none,1.0,The translation is accurate and conveys the same meaning as the English caption without any errors or ambiguities.
1215,83,111,468,346,people sitting on a couch,एक सोफे पर बैठे लोग,एक सोफे पर बैठे लोग,False,none,1.0,The Hindi translation correctly reflects the meaning of the English caption without any discrepancies or omissions.,একটি পালঙ্ক উপর বসে মানুষ,একটি পালঙ্ক উপর বসে মানুষ,False,none,1.0,The translation is accurate and captures the essence of the original caption without any discrepancies.,ഒരു വിരിപ്പിൽ ഇരിക്കുന്ന ജനം,ഒരു വിരിപ്പിൽ ഇരിക്കുന്ന ജനം,False,none,1.0,The translation is accurate and conveys the same meaning as the English caption without any issues.,ଲୋକମାନେ ଏକ ବିଛଣାରେ ବସିଛନ୍ତି |,ଲୋକମାନେ ଏକ ବିଛଣାରେ ବସିଛନ୍ତି |,False,none,1.0,The translation is accurate and captures the essence of the original English caption without any errors or omissions.
1222,180,47,39,41,light hanging from the ceiling,छत से लटके हुए प्रकाश,छत से लटके हुए प्रकाश,False,none,1.0,"The translation is accurate and natural, effectively representing the original English caption without any issues.",সিলিং থেকে হালকা ঝুলন্ত,ছাদ থেকে আলো ঝুলছে,True,poor_translation,0.7,"The translation uses ""হালকা"" which refers to weight rather than light as in illumination, leading to a potential misunderstanding of the intended meaning.",സീലിംഗിൽ നിന്ന് തൂങ്ങിക്കിടക്കുന്ന ലൈറ്റ്,സീലിംഗിൽ നിന്ന് തൂങ്ങിക്കിടക്കുന്ന ലൈറ്റ്,False,none,1.0,The translation is precise and maintains the original meaning without any ambiguity or errors.,ଛାତରୁ ଆଲୋକ ଝୁଲୁଛି |,ଛାତରୁ ଝୁଲୁଥିବା ଆଲୋକ,True,poor_translation,0.9,"The translation misinterprets ""ceiling"" as ""umbrella,"" leading to a significant error in meaning. The correct term for ""ceiling"" should be used to accurately convey the original caption."
1224,253,343,19,21,square hole in chair,कुर्सी में चौकोर छेद,कुर्सी में चौकोर छेद,False,none,1.0,The translation is accurate and conveys the same meaning as the English caption without any errors or ambiguities.,চেয়ারে বর্গাকার গর্ত,চেয়ারে বর্গাকার গর্ত,False,none,1.0,The translation is accurate and conveys the same meaning as the English caption without any issues.,ചതുരം മുഴുവൻ കസേരയിൽ,കസേരയിലെ ചതുരാകൃതിയിലുള്ള ദ്വാരം,True,poor_translation,0.9,"The target caption fails to represent the concept of a ""hole"" in the chair, instead suggesting a square shape that is present throughout the chair, which is a significant deviation from the original meaning.",ଚେୟାରରେ ବର୍ଗ ଛିଦ୍ର |,ଚେୟାରରେ ବର୍ଗ ଛିଦ୍ର |,False,none,1.0,The translation is correct and conveys the same meaning as the English caption without any errors or ambiguities.
1227,296,289,212,81,arms up in the air,हवा में हथियार,हवा में हाथ ऊपर करें,True,poor_translation,0.9,"The translation misinterprets ""arms"" as ""weapons,"" leading to a completely different meaning. The correct translation should focus on the action of raising arms, not implying the presence of weapons.",বাতাসে অস্ত্র আপ,বাতাসে হাত তুলুন,True,poor_translation,0.9,"The translation misinterprets ""arms"" as ""weapon,"" leading to a significant change in meaning. The correct translation should convey the action of raising arms, not weapons.",കൈകൾ വായുവിൽ,വായുവിൽ കൈകൾ ഉയർത്തുക,True,poor_translation,0.8,"The translation uses ""hands"" instead of ""arms,"" which alters the meaning slightly, making it a poor translation despite being contextually related.",ଆକାଶରେ ବାହୁ,ଆକାଶରେ ବାହୁ ଉଠାନ୍ତୁ,True,poor_translation,0.7,"The translation misses the specific action of ""up,"" which is essential to fully capture the meaning of the English caption. The phrase ""in the sky"" does not convey the same action as ""up in the air."""
1233,8,134,62,84,orange pail hanging from wall,नारंगी की दीवार से लटकी हुई,दीवार से लटकती नारंगी बाल्टी,True,poor_translation,0.8,"The target caption incorrectly describes the object as a wall instead of the pail, leading to a significant misrepresentation of the image content.",দেয়াল থেকে কমলা কমলা ঝুলছে,দেয়ালে কমলা বালতি ঝুলছে,True,poor_translation,0.7,"The translation fails to specify that it is a ""pail"" or ""bucket,"" leading to a misunderstanding of the object being described. Additionally, the phrasing is unnatural due to the repetition of ""কমলা.""",ഓറഞ്ച് പെയിൽ മതിലിൽ നിന്ന് തൂക്കിയിരിക്കുന്നു,ഓറഞ്ച് പെയിൽ മതിലിൽ നിന്ന് തൂക്കിയിരിക്കുന്നു,False,none,1.0,The translation is accurate and conveys the same meaning as the English caption without any errors or omissions.,କାନ୍ଥରେ ଝୁଲୁଥିବା କମଳା ରଙ୍ଗର ପେଲ୍ |,କାନ୍ଥରେ ଝୁଲୁଥିବା କମଳା ରଙ୍ଗର ପେଲ୍ |,False,none,0.9,"The translation is accurate and conveys the same meaning as the English caption, with only a slight variation in the term for ""orange."""
1234,528,391,188,148,white washer situated under a counter,एक काउंटर के नीचे स्थित सफेद वॉशर,एक काउंटर के नीचे स्थित सफेद वॉशर,False,none,1.0,The translation is precise and maintains the meaning of the original English caption without any errors or ambiguities.,সাদা ধোয়া একটি কাউন্টার অধীনে অবস্থিত,সাদা ধোয়া একটি কাউন্টার অধীনে অবস্থিত,False,none,1.0,The translation is accurate and conveys the same meaning as the English caption without any errors or ambiguities.,വെളുത്ത അലക്കുയന്ത്രം ഒരു കൗണ്ടറിന് കീഴിലാണ്,വെളുത്ത അലക്കുയന്ത്രം ഒരു കൗണ്ടറിന് കീഴിലാണ്,False,none,1.0,The translation is accurate and conveys the same meaning as the English caption without any discrepancies.,ଧଳା ଧୋଇବା ଏକ କାଉଣ୍ଟର ତଳେ ଅବସ୍ଥିତ |,ଧଳା ଧୋଇବା ଏକ କାଉଣ୍ଟର ତଳେ ଅବସ୍ଥିତ |,False,none,1.0,The translation is accurate and conveys the same meaning as the English caption without any errors or ambiguities.
1246,15,69,54,92,person sitting in front of window,खिड़की के सामने बैठा व्यक्ति,खिड़की के सामने बैठा व्यक्ति,False,none,1.0,"The Hindi caption ""खिड़की के सामने बैठा व्यक्ति"" correctly represents the English caption ""person sitting in front of window"" without any discrepancies.",উইন্ডো সামনে বসে ব্যক্তি,উইন্ডো সামনে বসে ব্যক্তি,False,none,1.0,The Bengali translation correctly reflects the meaning of the English caption without any errors or ambiguities.,ജാലകത്തിന് മുന്നിൽ ഇരിക്കുന്ന വ്യക്തി,ജാലകത്തിന് മുന്നിൽ ഇരിക്കുന്ന വ്യക്തി,False,none,1.0,The translation is accurate and maintains the meaning of the original English caption without any errors or ambiguities.,ଝରକା ସାମ୍ନାରେ ବସିଥିବା ବ୍ୟକ୍ତି |,ଝରକା ସାମ୍ନାରେ ବସିଥିବା ବ୍ୟକ୍ତି |,False,none,1.0,The translation is accurate and maintains the meaning of the original English caption without any errors or ambiguities.
